{
 "schema_version": "proxysql-digests-1.0",
 "captured_at": "2026-10-20T14:40:00+00:00",
 "available": true,
 "is_proxysql": true,
 "version": "3.0.11-797-g7c91137",
 "message": null,
 "filters": {
  "order": "time",
  "limit": 10,
  "hostgroup": null,
  "schema": null,
  "user": null,
  "text": null,
  "digest": "0xE1",
  "rule_id": null
 },
 "orders": [
  {
   "id": "slowest",
   "label": "Slowest",
   "available": true,
   "why": null
  },
  {
   "id": "time",
   "label": "Most time",
   "available": true,
   "why": null
  },
  {
   "id": "frequent",
   "label": "Most frequent",
   "available": true,
   "why": null
  },
  {
   "id": "rate",
   "label": "Highest rate",
   "available": true,
   "why": null
  },
  {
   "id": "rows",
   "label": "Most rows sent",
   "available": true,
   "why": null
  }
 ],
 "limits": [
  10,
  25,
  50,
  100
 ],
 "digests": [
  {
   "hostgroup": 32,
   "schemaname": "a|b",
   "username": "c",
   "client_address": "",
   "digest": "0xE1",
   "digest_text": "SELECT collision_one",
   "count_star": 1,
   "sum_time_us": 50000,
   "min_time_us": 50000,
   "max_time_us": 50000,
   "avg_time_us": 50000,
   "first_seen": 1792537331,
   "last_seen": 1792537331,
   "seen_span_s": 0,
   "rate_qps": 1.0,
   "rows_sent": 1,
   "rows_affected": 0,
   "key": "dg[32,\"a|b\",\"c\",\"\",\"0xE1\"]",
   "routing": {
    "observed": 32,
    "expected": 32,
    "source": "rule",
    "rules": [
     30
    ],
    "decisive": 30,
    "approximate": false,
    "possible": [],
    "unknown_rules": [],
    "default_hostgroup": null,
    "verdict": "match",
    "text": "Rule 30 sends it to hostgroup 32, where it ran.",
    "why": []
   }
  },
  {
   "hostgroup": 32,
   "schemaname": "a",
   "username": "b|c",
   "client_address": "",
   "digest": "0xE1",
   "digest_text": "SELECT collision_two",
   "count_star": 1,
   "sum_time_us": 50000,
   "min_time_us": 50000,
   "max_time_us": 50000,
   "avg_time_us": 50000,
   "first_seen": 1792537331,
   "last_seen": 1792537331,
   "seen_span_s": 0,
   "rate_qps": 1.0,
   "rows_sent": 1,
   "rows_affected": 0,
   "key": "dg[32,\"a\",\"b|c\",\"\",\"0xE1\"]",
   "routing": {
    "observed": 32,
    "expected": 32,
    "source": "rule",
    "rules": [
     30
    ],
    "decisive": 30,
    "approximate": false,
    "possible": [],
    "unknown_rules": [],
    "default_hostgroup": null,
    "verdict": "match",
    "text": "Rule 30 sends it to hostgroup 32, where it ran.",
    "why": []
   }
  }
 ],
 "more": false,
 "scanned": null,
 "facets": {
  "hostgroups": [
   {
    "value": 32,
    "digests": 5,
    "executions": 47
   },
   {
    "value": 30,
    "digests": 5,
    "executions": 25
   },
   {
    "value": 10,
    "digests": 2,
    "executions": 10
   }
  ],
  "schemas": [
   {
    "value": "information_schema",
    "digests": 10,
    "executions": 80
   },
   {
    "value": "a",
    "digests": 1,
    "executions": 1
   },
   {
    "value": "a|b",
    "digests": 1,
    "executions": 1
   }
  ],
  "users": [
   {
    "value": "mf_admin",
    "digests": 10,
    "executions": 80
   },
   {
    "value": "b|c",
    "digests": 1,
    "executions": 1
   },
   {
    "value": "c",
    "digests": 1,
    "executions": 1
   }
  ],
  "complete": true
 },
 "totals": {
  "digests": 12,
  "executions": 82,
  "sum_time_us": 155113
 },
 "window": {
  "first_seen": 1792537331,
  "last_seen": 1792543106
 },
 "rules": [
  {
   "rule_id": 10,
   "destination_hostgroup": 10,
   "apply": true,
   "flagIN": 0,
   "flagOUT": null,
   "username": null,
   "schemaname": null,
   "match_digest": null,
   "match_pattern": "^/\\* galera \\*/",
   "negate_match_pattern": false,
   "caseless": true,
   "comment": "galera"
  },
  {
   "rule_id": 20,
   "destination_hostgroup": 30,
   "apply": true,
   "flagIN": 0,
   "flagOUT": null,
   "username": null,
   "schemaname": null,
   "match_digest": "^SELECT .* FOR UPDATE",
   "match_pattern": null,
   "negate_match_pattern": false,
   "caseless": true,
   "comment": "locking reads"
  },
  {
   "rule_id": 30,
   "destination_hostgroup": 32,
   "apply": true,
   "flagIN": 0,
   "flagOUT": null,
   "username": null,
   "schemaname": null,
   "match_digest": "^SELECT",
   "match_pattern": null,
   "negate_match_pattern": false,
   "caseless": true,
   "comment": "reads"
  }
 ],
 "rule_hits": {
  "10": 6,
  "20": 5,
  "30": 41
 },
 "routing": {
  "evaluated": true,
  "regex_engine": "PCRE",
  "regex_variable": "1",
  "iterations": 0,
  "fast_routing_read": true,
  "users_read": true,
  "track_hostname": false,
  "active_rules": 3,
  "note": null
 },
 "notes": [],
 "statements": [
  "SELECT variable_name, variable_value FROM runtime_global_variables WHERE variable_name IN ('mysql-query_processor_regex', 'mysql-query_processor_iterations', 'mysql-query_digests', 'mysql-query_digests_track_hostname', 'mysql-select_version_forwarding')",
  "SELECT * FROM runtime_mysql_query_rules",
  "SELECT * FROM runtime_mysql_query_rules_fast_routing",
  "SELECT username, active, default_hostgroup, transaction_persistent, frontend FROM runtime_mysql_users",
  "SELECT * FROM stats_mysql_query_rules",
  "SELECT hostgroup, schemaname, username, COUNT(*) AS digests, SUM(count_star) AS executions, SUM(sum_time) AS sum_time, MIN(first_seen) AS first_seen, MAX(last_seen) AS last_seen FROM stats_mysql_query_digest GROUP BY hostgroup, schemaname, username ORDER BY executions DESC LIMIT 201",
  "SELECT * FROM stats_mysql_query_digest WHERE digest = CAST(X'30784531' AS TEXT) ORDER BY sum_time DESC, sum_time DESC, count_star DESC, digest LIMIT 11"
 ]
}
